2025-11-30 17:02:42 - 
 Verificando conexión con Jira...
2025-11-30 17:02:42 - ✅ Conectado a Jira como: Cristian Camilo Naranjo Valencia (cristian.naranjo@outlook.es)
2025-11-30 17:02:42 - 
 Verificando proyecto: VELA
2025-11-30 17:02:43 - ✅ Proyecto encontrado: Vela Lang
2025-11-30 17:02:44 -  No se encontró board Scrum específico, buscando cualquier board...
2025-11-30 17:02:45 - ✅ Board encontrado: SCRUM board (ID: 1, Type: simple)
2025-11-30 17:03:03 - 
📗 FASE 2: Creando User Stories...
2025-11-30 17:03:04 -   ✅ Story creada: VELA-48 - US-00A: Como líder técnico, necesito tomar decisiones arquitectónicas críticas antes de escribir código
2025-11-30 17:03:06 -   ✅ Story creada: VELA-49 - US-00B: Como desarrollador del compilador, necesito especificaciones formales completas para implementación correcta
2025-11-30 17:03:07 -   ✅ Story creada: VELA-50 - US-00C: Como desarrollador de tooling, necesito arquitecturas diseñadas antes de implementar herramientas
2025-11-30 17:03:09 -   ✅ Story creada: VELA-51 - US-00D: Como desarrollador, necesito infraestructura base configurada antes de comenzar desarrollo
2025-11-30 17:03:11 -   ✅ Story creada: VELA-52 - US-00E: Como miembro de la comunidad, necesito documentación de gobernanza y procesos de contribución
2025-11-30 17:03:12 -   ✅ Story creada: VELA-53 - US-00F: Como líder técnico, necesito validar decisiones arquitectónicas con prototipos
2025-11-30 17:03:14 -   ✅ Story creada: VELA-54 - US-01: Como desarrollador, quiero definir la gramática completa de Vela para poder escribir código válido
2025-11-30 17:03:15 -   ✅ Story creada: VELA-55 - US-02: Como desarrollador, quiero un lexer funcional para tokenizar código fuente
2025-11-30 17:03:16 -   ✅ Story creada: VELA-56 - US-03: Como desarrollador, quiero un parser que genere AST válido
2025-11-30 17:03:18 -   ✅ Story creada: VELA-57 - US-03B: Como desarrollador, quiero keywords específicos por tipo para código más semántico
2025-11-30 17:03:19 -   ✅ Story creada: VELA-58 - US-04: Como desarrollador, quiero un type checker robusto para validar tipos
2025-11-30 17:03:21 -   ✅ Story creada: VELA-59 - US-04B: Como desarrollador, quiero validación estricta de keywords específicos
2025-11-30 17:03:22 -   ✅ Story creada: VELA-60 - US-05: Como desarrollador, quiero un semantic analyzer para validar scopes
2025-11-30 17:03:24 -   ✅ Story creada: VELA-61 - US-06: Como desarrollador, quiero usar signals para estado reactivo
2025-11-30 17:03:25 -   ✅ Story creada: VELA-62 - US-07: Como desarrollador, quiero un scheduler reactivo eficiente
2025-11-30 17:03:27 -   ✅ Story creada: VELA-63 - US-07B: Como desarrollador, quiero inyección de dependencias automática para arquitectura limpia
2025-11-30 17:03:28 -   ✅ Story creada: VELA-64 - US-07C: Como desarrollador, quiero un sistema de eventos genérico para comunicación desacoplada
2025-11-30 17:03:30 -   ✅ Story creada: VELA-65 - US-07D: Como desarrollador, quiero state management global para apps complejas
2025-11-30 17:03:31 -   ✅ Story creada: VELA-66 - US-08: Como desarrollador, quiero crear y usar actors para concurrencia segura
2025-11-30 17:03:33 -   ✅ Story creada: VELA-67 - US-09: Como desarrollador, quiero supervision hierarchy para manejo de errores
2025-11-30 17:03:34 -   ✅ Story creada: VELA-68 - US-10: Como desarrollador, quiero usar async/await para código asíncrono
2025-11-30 17:03:36 -   ✅ Story creada: VELA-69 - US-11: Como desarrollador, quiero workers para computación paralela
2025-11-30 17:03:37 -   ✅ Story creada: VELA-70 - US-12: Como desarrollador, quiero crear interfaces con widgets declarativos
2025-11-30 17:03:39 -   ✅ Story creada: VELA-71 - US-13: Como desarrollador, quiero un sistema reactivo integrado en UI
2025-11-30 17:03:40 -   ✅ Story creada: VELA-72 - US-14: Como desarrollador, quiero sistema de estilos y theming
2025-11-30 17:03:42 -   ✅ Story creada: VELA-73 - US-15: Como desarrollador, quiero navegación y routing
2025-11-30 17:03:43 -   ✅ Story creada: VELA-74 - US-16: Como desarrollador, quiero un intérprete de bytecode funcional
2025-11-30 17:03:45 -   ✅ Story creada: VELA-75 - US-17: Como desarrollador, quiero memory management automático
2025-11-30 17:03:46 -   ✅ Story creada: VELA-76 - US-18: Como desarrollador, quiero un module loader funcional
2025-11-30 17:03:47 -   ✅ Story creada: VELA-77 - US-19: Como desarrollador, quiero colecciones estándar (List, Set, Dict)
2025-11-30 17:03:49 -   ✅ Story creada: VELA-78 - US-20: Como desarrollador, quiero APIs de I/O y networking
2025-11-30 17:03:50 -   ✅ Story creada: VELA-79 - US-21: Como desarrollador, quiero serialización JSON
2025-11-30 17:03:52 -   ✅ Story creada: VELA-80 - US-22: Como desarrollador, quiero un CLI para gestionar proyectos
2025-11-30 17:03:53 -   ✅ Story creada: VELA-81 - US-23: Como desarrollador, quiero un package manager
2025-11-30 17:03:55 -   ✅ Story creada: VELA-82 - US-24: Como desarrollador, quiero autocompletado y diagnósticos en mi editor
2025-11-30 17:03:56 -   ✅ Story creada: VELA-83 - US-24A: Como desarrollador, quiero un sistema de eventos genérico para comunicación desacoplada
2025-11-30 17:03:58 -   ✅ Story creada: VELA-84 - US-24B: Como desarrollador, quiero validación de datos integrada para seguridad
2025-11-30 17:03:59 -   ✅ Story creada: VELA-85 - US-24C: Como desarrollador, quiero logging estructurado para debugging y observabilidad
2025-11-30 17:04:01 -   ✅ Story creada: VELA-86 - US-24D: Como desarrollador, quiero internacionalización para apps globales
2025-11-30 17:04:03 -   ✅ Story creada: VELA-87 - US-24E: Como desarrollador, quiero service discovery para microservicios
2025-11-30 17:04:04 -   ✅ Story creada: VELA-88 - US-24F: Como desarrollador, quiero message brokers para event-driven microservices
2025-11-30 17:04:06 -   ✅ Story creada: VELA-89 - US-24G: Como desarrollador, quiero resilience patterns para microservicios confiables
2025-11-30 17:04:07 -   ✅ Story creada: VELA-90 - US-24H: Como desarrollador, quiero observability para monitorear microservicios
2025-11-30 17:04:09 -   ✅ Story creada: VELA-91 - US-24I: Como desarrollador, quiero ORM type-safe para acceso a base de datos
2025-11-30 17:04:10 -   ✅ Story creada: VELA-92 - US-24J: Como desarrollador, quiero criptografía estándar para seguridad
2025-11-30 17:04:12 -   ✅ Story creada: VELA-93 - US-24K: Como desarrollador, quiero serialización avanzada para APIs
2025-11-30 17:04:13 -   ✅ Story creada: VELA-94 - US-24L: Como desarrollador, quiero config management para microservicios
2025-11-30 17:04:14 -   ✅ Story creada: VELA-95 - US-24M: Como desarrollador, quiero API Gateway para routing y load balancing
2025-11-30 17:04:16 -   ✅ Story creada: VELA-96 - US-24N: Como desarrollador, quiero gRPC para comunicación eficiente entre servicios
2025-11-30 17:04:18 -   ✅ Story creada: VELA-97 - US-24O: Como desarrollador, quiero testing avanzado para calidad de código
2025-11-30 17:04:19 -   ✅ Story creada: VELA-98 - US-25: Como desarrollador, quiero compilar a JavaScript para web
2025-11-30 17:04:21 -   ✅ Story creada: VELA-99 - US-25A: Como desarrollador, quiero pattern matching avanzado para código expresivo
2025-11-30 17:04:22 -   ✅ Story creada: VELA-100 - US-25B: Como desarrollador, quiero async iterators para procesamiento de datos infinitos
2025-11-30 17:04:24 -   ✅ Story creada: VELA-101 - US-25C: Como desarrollador, quiero worker pools para procesamiento paralelo
2025-11-30 17:04:26 -   ✅ Story creada: VELA-102 - US-26: Como desarrollador, quiero compilar a WebAssembly para performance
2025-11-30 17:04:28 -   ✅ Story creada: VELA-103 - US-27: Como desarrollador, quiero compilación nativa para máximo rendimiento
2025-11-30 17:04:30 -   ✅ Story creada: VELA-104 - US-28: Como desarrollador, quiero escribir y ejecutar tests unitarios
2025-11-30 17:04:32 -   ✅ Story creada: VELA-105 - US-29: Como desarrollador, quiero documentación completa del lenguaje
2025-11-30 17:04:34 -   ✅ Story creada: VELA-106 - US-30: Como desarrollador, quiero debugger para inspeccionar ejecución
2025-11-30 17:04:36 -   ✅ Story creada: VELA-107 - US-31: Como desarrollador, quiero animaciones fluidas en UI
2025-11-30 17:04:37 -   ✅ Story creada: VELA-108 - US-32: Como desarrollador, quiero gestures avanzados
2025-11-30 17:04:39 -   ✅ Story creada: VELA-109 - US-33: Como desarrollador, quiero listas virtualizadas eficientes
2025-11-30 17:04:41 -   ✅ Story creada: VELA-110 - US-34: Como desarrollador, quiero desplegar apps en iOS
2025-11-30 17:04:43 -   ✅ Story creada: VELA-111 - US-35: Como desarrollador, quiero desplegar apps en Android
2025-11-30 17:04:45 -   ✅ Story creada: VELA-112 - US-36: Como desarrollador, quiero apps desktop nativas
2025-11-30 17:04:47 -   ✅ Story creada: VELA-113 - US-37: Como desarrollador, quiero llamar código C desde Vela
2025-11-30 17:04:49 -   ✅ Story creada: VELA-114 - US-38: Como desarrollador, quiero código optimizado para mejor performance
2025-11-30 17:04:51 -   ✅ Story creada: VELA-115 - US-39: Como desarrollador, quiero desplegar apps en cloud (serverless)
2025-11-30 17:04:51 - 
📙 FASE 3: Creando Tasks...
2025-11-30 17:04:53 -   ✅ Sprint creado: Sprint 0 (ID: 2)
2025-11-30 17:04:54 -     ❌ Error creando Task TASK-000A: Decidir lenguaje de implementación: 400
2025-11-30 17:04:55 -     ❌ Error creando Task TASK-000B: Definir arquitectura del build system: 400
2025-11-30 17:04:56 -     ❌ Error creando Task TASK-000C: Elegir licencia open source: 400
2025-11-30 17:04:58 -     ❌ Error creando Task TASK-000D: Seleccionar plataforma CI/CD: 400
2025-11-30 17:04:59 -     ❌ Error creando Task TASK-000E: Elegir plataforma de documentación: 400
2025-11-30 17:05:00 -     ❌ Error creando Task TASK-000F: Escribir especificación formal del lenguaje: 400
2025-11-30 17:05:02 -     ❌ Error creando Task TASK-000G: Especificar modelo de memoria formal: 400
2025-11-30 17:05:04 -     ❌ Error creando Task TASK-000H: Especificar modelo de concurrencia formal: 400
2025-11-30 17:05:05 -     ❌ Error creando Task TASK-000I: Escribir contratos formales de stdlib: 400
2025-11-30 17:05:07 -     ❌ Error creando Task TASK-000J: Diseñar arquitectura del Vela CLI: 400
2025-11-30 17:05:08 -     ❌ Error creando Task TASK-000K: Diseñar arquitectura del package manager: 400
2025-11-30 17:05:10 -     ❌ Error creando Task TASK-000L: Diseñar arquitectura del LSP: 400
2025-11-30 17:05:11 -     ❌ Error creando Task TASK-000M: Diseñar arquitectura de DevTools: 400
2025-11-30 17:05:12 -     ❌ Error creando Task TASK-000N: Configurar estructura de repositorio: 400
2025-11-30 17:05:14 -     ❌ Error creando Task TASK-000O: Configurar pipeline CI/CD: 400
2025-11-30 17:05:15 -     ❌ Error creando Task TASK-000P: Configurar website de documentación: 400
2025-11-30 17:05:17 -     ❌ Error creando Task TASK-000Q: Configurar infraestructura de testing: 400
2025-11-30 17:05:18 -     ❌ Error creando Task TASK-000R: Escribir CONTRIBUTING.md: 400
2025-11-30 17:05:20 -     ❌ Error creando Task TASK-000S: Escribir CODE_OF_CONDUCT.md: 400
2025-11-30 17:05:21 -     ❌ Error creando Task TASK-000T: Escribir GOVERNANCE.md: 400
2025-11-30 17:05:22 -     ❌ Error creando Task TASK-000U: Establecer proceso RFC: 400
2025-11-30 17:05:24 -     ❌ Error creando Task TASK-000V: Implementar prototipo de lexer: 400
2025-11-30 17:05:25 -     ❌ Error creando Task TASK-000W: Implementar prototipo de parser: 400
2025-11-30 17:05:27 -     ❌ Error creando Task TASK-000X: Validar toolchain choices: 400
2025-11-30 17:05:28 -     ❌ Error creando Task TASK-000Y: Crear framework de benchmarking: 400
2025-11-30 17:05:30 -   ✅ Sprint creado: Sprint 1 (ID: 3)
2025-11-30 17:05:31 -     ❌ Error creando Task TASK-001: Definir gramática EBNF completa: 400
2025-11-30 17:05:33 -     ❌ Error creando Task TASK-002: Documentar precedencia de operadores: 400
2025-11-30 17:05:34 -     ❌ Error creando Task TASK-003: Definir palabras reservadas: 400
2025-11-30 17:05:36 -   ✅ Sprint creado: Sprint 2 (ID: 4)
2025-11-30 17:05:37 -     ❌ Error creando Task TASK-004: Implementar lexer con state machine: 400
2025-11-30 17:05:39 -     ❌ Error creando Task TASK-005: Implementar string interpolation en lexer: 400
2025-11-30 17:05:40 -     ❌ Error creando Task TASK-006: Implementar tracking de posiciones: 400
2025-11-30 17:05:42 -     ❌ Error creando Task TASK-007: Tests unitarios de lexer: 400
2025-11-30 17:05:44 -   ✅ Sprint creado: Sprint 3 (ID: 5)
2025-11-30 17:05:45 -     ❌ Error creando Task TASK-008: Implementar parser recursive descent: 400
2025-11-30 17:05:47 -     ❌ Error creando Task TASK-009: Implementar Pratt parsing para expresiones: 400
2025-11-30 17:05:48 -     ❌ Error creando Task TASK-010: Definir estructura completa de AST: 400
2025-11-30 17:05:50 -   ✅ Sprint creado: Sprint 4 (ID: 6)
2025-11-30 17:05:51 -     ❌ Error creando Task TASK-011: Implementar error recovery en parser: 400
2025-11-30 17:05:53 -     ❌ Error creando Task TASK-012: Tests de parser con casos edge: 400
2025-11-30 17:05:54 -     ❌ Error creando Task TASK-012A: Implementar sistema de imports con prefijos: 400
2025-11-30 17:05:55 -     ❌ Error creando Task TASK-012B: Implementar parser para 30 keywords específicos: 400
2025-11-30 17:05:57 -     ❌ Error creando Task TASK-012C: Implementar AST nodes para keywords específicos: 400
2025-11-30 17:05:58 -     ❌ Error creando Task TASK-013: Diseñar representación interna de tipos: 400
2025-11-30 17:06:00 -   ✅ Sprint creado: Sprint 5 (ID: 7)
2025-11-30 17:06:01 -     ❌ Error creando Task TASK-014: Implementar algoritmo de inferencia Hindley-Milner: 400
2025-11-30 17:06:03 -     ❌ Error creando Task TASK-015: Implementar type checking de expresiones: 400
2025-11-30 17:06:05 -   ✅ Sprint creado: Sprint 6 (ID: 8)
2025-11-30 17:06:06 -     ❌ Error creando Task TASK-016: Implementar type checking de statements: 400
2025-11-30 17:06:07 -     ❌ Error creando Task TASK-016A: Implementar validación de widget/component: 400
2025-11-30 17:06:09 -     ❌ Error creando Task TASK-016B: Implementar validación de service/repository: 400
2025-11-30 17:06:10 -     ❌ Error creando Task TASK-016C: Implementar validación de entity/dto/valueObject: 400
2025-11-30 17:06:12 -   ✅ Sprint creado: Sprint 7 (ID: 9)
2025-11-30 17:06:13 -     ❌ Error creando Task TASK-016D: Implementar validación de patrones (factory, builder, strategy, etc): 400
2025-11-30 17:06:14 -     ❌ Error creando Task TASK-016E: Implementar validación de controller/middleware/guard: 400
2025-11-30 17:06:16 -     ❌ Error creando Task TASK-016F: Tests de validación de keywords: 400
2025-11-30 17:06:17 -     ❌ Error creando Task TASK-017: Implementar soporte para generics: 400
2025-11-30 17:06:18 -     ❌ Error creando Task TASK-018: Implementar null-safety checking: 400
2025-11-30 17:06:20 -     ❌ Error creando Task TASK-019: Implementar type narrowing: 400
2025-11-30 17:06:21 -     ❌ Error creando Task TASK-020: Tests de type system: 400
2025-11-30 17:06:23 -   ✅ Sprint creado: Sprint 8 (ID: 10)
2025-11-30 17:06:24 -     ❌ Error creando Task TASK-021: Implementar symbol table: 400
2025-11-30 17:06:25 -     ❌ Error creando Task TASK-021A: Implementar resolución de imports con prefijos: 400
2025-11-30 17:06:27 -     ❌ Error creando Task TASK-021B: Validar reglas de imports por keyword: 400
2025-11-30 17:06:28 -     ❌ Error creando Task TASK-022: Implementar name resolution: 400
2025-11-30 17:06:29 -     ❌ Error creando Task TASK-023: Validar visibilidad (public/private): 400
2025-11-30 17:06:31 -   ✅ Sprint creado: Sprint 9 (ID: 11)
2025-11-30 17:06:32 -     ❌ Error creando Task TASK-024: Tests de semantic analysis: 400
2025-11-30 17:06:34 -     ❌ Error creando Task TASK-025: Diseñar arquitectura del grafo reactivo: 400
2025-11-30 17:06:35 -     ❌ Error creando Task TASK-026: Implementar Signal<T> core: 400
2025-11-30 17:06:38 -   ✅ Sprint creado: Sprint 10 (ID: 12)
2025-11-30 17:06:39 -     ❌ Error creando Task TASK-027: Implementar dependency tracking: 400
2025-11-30 17:06:40 -     ❌ Error creando Task TASK-028: Implementar Computed<T>: 400
2025-11-30 17:06:42 -     ❌ Error creando Task TASK-029: Implementar Effect: 400
2025-11-30 17:06:44 -   ✅ Sprint creado: Sprint 11 (ID: 13)
2025-11-30 17:06:45 -     ❌ Error creando Task TASK-030: Implementar Watch: 400
2025-11-30 17:06:47 -     ❌ Error creando Task TASK-031: Implementar reactive scheduler: 400
2025-11-30 17:06:48 -     ❌ Error creando Task TASK-032: Implementar batch() API: 400
2025-11-30 17:06:50 -   ✅ Sprint creado: Sprint 12 (ID: 14)
2025-11-30 17:06:51 -     ❌ Error creando Task TASK-033: Optimizar propagación con memoization: 400
2025-11-30 17:06:52 -     ❌ Error creando Task TASK-034: Implementar garbage collection de signals: 400
2025-11-30 17:06:54 -     ❌ Error creando Task TASK-035: Tests de sistema reactivo: 400
2025-11-30 17:06:56 -   ✅ Sprint creado: Sprint 13 (ID: 15)
2025-11-30 17:06:57 -     ❌ Error creando Task TASK-035A: Diseñar arquitectura del sistema DI: 400
2025-11-30 17:06:58 -     ❌ Error creando Task TASK-035B: Implementar @injectable decorator: 400
2025-11-30 17:06:59 -     ❌ Error creando Task TASK-035C: Implementar @inject decorator: 400
2025-11-30 17:07:02 -   ✅ Sprint creado: Sprint 14 (ID: 16)
2025-11-30 17:07:03 -     ❌ Error creando Task TASK-035D: Implementar @container decorator: 400
2025-11-30 17:07:04 -     ❌ Error creando Task TASK-035D2: Implementar @controller decorator: 400
2025-11-30 17:07:05 -     ❌ Error creando Task TASK-035D3: Implementar decoradores HTTP (@get @post @put @delete @patch): 400
2025-11-30 17:07:07 -     ❌ Error creando Task TASK-035E: Implementar @provides decorator: 400
2025-11-30 17:07:09 -   ✅ Sprint creado: Sprint 15 (ID: 17)
2025-11-30 17:07:10 -     ❌ Error creando Task TASK-035E2: Implementar @middleware y @guard decorators: 400
2025-11-30 17:07:11 -     ❌ Error creando Task TASK-035F: Implementar Injector core: 400
2025-11-30 17:07:12 -     ❌ Error creando Task TASK-035G: Implementar Scopes (Singleton, Transient, Scoped): 400
2025-11-30 17:07:14 -     ❌ Error creando Task TASK-035G2: Implementar Router HTTP: 400
2025-11-30 17:07:16 -   ✅ Sprint creado: Sprint 16 (ID: 18)
2025-11-30 17:07:17 -     ❌ Error creando Task TASK-035G3: Implementar Request/Response types: 400
2025-11-30 17:07:18 -     ❌ Error creando Task TASK-035H: Implementar circular dependency detection: 400
2025-11-30 17:07:20 -     ❌ Error creando Task TASK-035I: Integrar DI con testing framework: 400
2025-11-30 17:07:22 -   ✅ Sprint creado: Sprint 17 (ID: 19)
2025-11-30 17:07:23 -     ❌ Error creando Task TASK-035J: Tests de sistema DI y REST: 400
2025-11-30 17:07:24 -     ❌ Error creando Task TASK-035K: Diseñar arquitectura del Event Bus: 400
2025-11-30 17:07:26 -     ❌ Error creando Task TASK-035L: Implementar EventBus<T> core: 400
2025-11-30 17:07:27 -   ✅ Sprint creado: Sprint 18 (ID: 20)
2025-11-30 17:07:28 -     ❌ Error creando Task TASK-035M: Implementar on/emit/off keywords: 400
2025-11-30 17:07:28 -     ❌ Error creando Task TASK-035N: Implementar EventEmitter interface: 400
2025-11-30 17:07:29 -     ❌ Error creando Task TASK-035O: Implementar event propagation: 400
2025-11-30 17:07:31 -   ✅ Sprint creado: Sprint 19 (ID: 21)
2025-11-30 17:07:31 -     ❌ Error creando Task TASK-035P: Implementar event filtering: 400
2025-11-30 17:07:32 -     ❌ Error creando Task TASK-035Q: Tests de Event System: 400
2025-11-30 17:07:34 -     ❌ Error creando Task TASK-035R: Diseñar arquitectura de Store: 400
2025-11-30 17:07:34 -     ❌ Error creando Task TASK-035S: Implementar Store<T> base class: 400
2025-11-30 17:07:36 -   ✅ Sprint creado: Sprint 20 (ID: 22)
2025-11-30 17:07:36 -     ❌ Error creando Task TASK-035T: Implementar Action y Reducer types: 400
2025-11-30 17:07:37 -     ❌ Error creando Task TASK-035U: Implementar dispatch keyword: 400
2025-11-30 17:07:38 -     ❌ Error creando Task TASK-035V: Implementar @connect decorator: 400
2025-11-30 17:07:39 -   ✅ Sprint creado: Sprint 21 (ID: 23)
2025-11-30 17:07:40 -     ❌ Error creando Task TASK-035W: Implementar @select decorator: 400
2025-11-30 17:07:41 -     ❌ Error creando Task TASK-035X: Implementar @persistent decorator: 400
2025-11-30 17:07:42 -     ❌ Error creando Task TASK-035Y: Implementar middleware system: 400
2025-11-30 17:07:43 -   ✅ Sprint creado: Sprint 22 (ID: 24)
2025-11-30 17:07:44 -     ❌ Error creando Task TASK-035Z: Implementar DevTools integration: 400
2025-11-30 17:07:45 -     ❌ Error creando Task TASK-035AA: Tests de State Management: 400
2025-11-30 17:07:46 -   ✅ Sprint creado: Sprint 23 (ID: 25)
2025-11-30 17:07:47 -     ❌ Error creando Task TASK-036: Diseñar actor system architecture: 400
2025-11-30 17:07:47 -     ❌ Error creando Task TASK-037: Implementar actor instances: 400
2025-11-30 17:07:48 -     ❌ Error creando Task TASK-038: Implementar mailbox system: 400
2025-11-30 17:07:50 -   ✅ Sprint creado: Sprint 24 (ID: 26)
2025-11-30 17:07:50 -     ❌ Error creando Task TASK-039: Implementar message processing loop: 400
2025-11-30 17:07:51 -     ❌ Error creando Task TASK-040: Implementar thread pool executor: 400
2025-11-30 17:07:52 -     ❌ Error creando Task TASK-041: Implementar actor scheduling: 400
2025-11-30 17:07:53 -   ✅ Sprint creado: Sprint 25 (ID: 27)
2025-11-30 17:07:54 -     ❌ Error creando Task TASK-042: Implementar supervision strategies: 400
2025-11-30 17:07:55 -     ❌ Error creando Task TASK-043: Implementar restart logic: 400
2025-11-30 17:07:56 -     ❌ Error creando Task TASK-044: Tests de actor system: 400
2025-11-30 17:07:58 -   ✅ Sprint creado: Sprint 26 (ID: 28)
2025-11-30 17:07:59 -     ❌ Error creando Task TASK-045: Diseñar async/await semantics: 400
2025-11-30 17:08:00 -     ❌ Error creando Task TASK-046: Implementar async transform (CPS): 400
2025-11-30 17:08:02 -   ✅ Sprint creado: Sprint 27 (ID: 29)
2025-11-30 17:08:03 -     ❌ Error creando Task TASK-047: Implementar Future<T> y Promise<T>: 400
2025-11-30 17:08:05 -     ❌ Error creando Task TASK-048: Implementar executor para futures: 400
2025-11-30 17:08:06 -     ❌ Error creando Task TASK-049: Tests de async/await: 400
2025-11-30 17:08:08 -   ✅ Sprint creado: Sprint 28 (ID: 30)
2025-11-30 17:08:09 -     ❌ Error creando Task TASK-050: Implementar Worker API: 400
2025-11-30 17:08:11 -     ❌ Error creando Task TASK-051: Implementar Channel<T>: 400
2025-11-30 17:08:12 -     ❌ Error creando Task TASK-052: Tests de workers y channels: 400
2025-11-30 17:08:13 -     ❌ Error creando Task TASK-053: Diseñar arquitectura de widgets: 400
2025-11-30 17:08:15 -     ❌ Error creando Task TASK-054: Implementar Widget base class: 400
2025-11-30 17:08:16 -     ❌ Error creando Task TASK-055: Implementar widgets de layout (Container, Row, Column, Stack): 400
2025-11-30 17:08:17 -     ❌ Error creando Task TASK-056: Implementar widgets de input (Button, TextField, Checkbox): 400
2025-11-30 17:08:19 -     ❌ Error creando Task TASK-057: Implementar widgets de display (Text, Image, Icon): 400
2025-11-30 17:08:20 -     ❌ Error creando Task TASK-058: Integrar signals con widgets: 400
2025-11-30 17:08:21 -     ❌ Error creando Task TASK-059: Implementar Virtual DOM: 400
2025-11-30 17:08:23 -     ❌ Error creando Task TASK-060: Implementar diffing algorithm: 400
2025-11-30 17:08:24 -     ❌ Error creando Task TASK-061: Implementar patching system: 400
2025-11-30 17:08:25 -     ❌ Error creando Task TASK-062: Tests de reconciliación reactiva: 400
2025-11-30 17:08:26 -     ❌ Error creando Task TASK-063: Implementar TextStyle y styling APIs: 400
2025-11-30 17:08:27 -     ❌ Error creando Task TASK-064: Implementar Color y EdgeInsets: 400
2025-11-30 17:08:28 -     ❌ Error creando Task TASK-065: Implementar Theme system: 400
2025-11-30 17:08:29 -     ❌ Error creando Task TASK-066: Implementar Router widget: 400
2025-11-30 17:08:30 -     ❌ Error creando Task TASK-067: Implementar Navigation API: 400
2025-11-30 17:08:31 -     ❌ Error creando Task TASK-068: Tests de navegación: 400
2025-11-30 17:08:32 -     ❌ Error creando Task TASK-069: Diseñar bytecode instruction set: 400
2025-11-30 17:08:33 -     ❌ Error creando Task TASK-070: Implementar bytecode generator desde IR: 400
2025-11-30 17:08:34 -     ❌ Error creando Task TASK-071: Implementar VelaVM core (stack machine): 400
2025-11-30 17:08:36 -     ❌ Error creando Task TASK-072: Implementar heap allocation: 400
2025-11-30 17:08:37 -     ❌ Error creando Task TASK-073: Implementar call stack: 400
2025-11-30 17:08:39 -     ❌ Error creando Task TASK-074: Tests de VelaVM: 400
2025-11-30 17:08:40 -     ❌ Error creando Task TASK-075: Implementar ARC (Automatic Reference Counting): 400
2025-11-30 17:08:41 -     ❌ Error creando Task TASK-076: Implementar cycle detection: 400
2025-11-30 17:08:43 -     ❌ Error creando Task TASK-077: Integrar ARC con sistema reactivo: 400
2025-11-30 17:08:44 -     ❌ Error creando Task TASK-078: Tests de memory management: 400
2025-11-30 17:08:45 -     ❌ Error creando Task TASK-079: Implementar module resolution: 400
2025-11-30 17:08:47 -   ✅ Sprint creado: Sprint 29 (ID: 31)
2025-11-30 17:08:48 -     ❌ Error creando Task TASK-080: Implementar bytecode loader: 400
2025-11-30 17:08:49 -     ❌ Error creando Task TASK-081: Tests de module system: 400
2025-11-30 17:08:49 -     ❌ Error creando Task TASK-082: Implementar List<T>: 400
2025-11-30 17:08:51 -   ✅ Sprint creado: Sprint 30 (ID: 32)
2025-11-30 17:08:51 -     ❌ Error creando Task TASK-083: Implementar Set<T>: 400
2025-11-30 17:08:52 -     ❌ Error creando Task TASK-084: Implementar Dict<K,V>: 400
2025-11-30 17:08:53 -     ❌ Error creando Task TASK-085: Implementar Queue y Stack: 400
2025-11-30 17:08:54 -   ✅ Sprint creado: Sprint 31 (ID: 33)
2025-11-30 17:08:55 -     ❌ Error creando Task TASK-086: Tests de colecciones: 400
2025-11-30 17:08:56 -     ❌ Error creando Task TASK-087: Implementar File API: 400
2025-11-30 17:08:57 -     ❌ Error creando Task TASK-088: Implementar Directory API: 400
2025-11-30 17:08:58 -   ✅ Sprint creado: Sprint 32 (ID: 34)
2025-11-30 17:08:58 -     ❌ Error creando Task TASK-089: Implementar HttpClient: 400
2025-11-30 17:08:59 -     ❌ Error creando Task TASK-090: Implementar WebSocket: 400
2025-11-30 17:09:00 -   ✅ Sprint creado: Sprint 33 (ID: 35)
2025-11-30 17:09:01 -     ❌ Error creando Task TASK-091: Tests de I/O y networking: 400
2025-11-30 17:09:02 -     ❌ Error creando Task TASK-092: Implementar JSON parser: 400
2025-11-30 17:09:03 -     ❌ Error creando Task TASK-093: Implementar JSON encoder: 400
2025-11-30 17:09:04 -   ✅ Sprint creado: Sprint 34 (ID: 36)
2025-11-30 17:09:05 -     ❌ Error creando Task TASK-094: Implementar JSON decorators para types: 400
2025-11-30 17:09:06 -     ❌ Error creando Task TASK-095: Tests de JSON: 400
2025-11-30 17:09:07 -     ❌ Error creando Task TASK-096: Implementar vela create: 400
2025-11-30 17:09:08 -   ✅ Sprint creado: Sprint 35 (ID: 37)
2025-11-30 17:09:08 -     ❌ Error creando Task TASK-097: Implementar vela build: 400
2025-11-30 17:09:09 -     ❌ Error creando Task TASK-098: Implementar vela run: 400
2025-11-30 17:09:10 -     ❌ Error creando Task TASK-099: Implementar vela test: 400
2025-11-30 17:09:12 -   ✅ Sprint creado: Sprint 36 (ID: 38)
2025-11-30 17:09:12 -     ❌ Error creando Task TASK-100: Implementar vela fmt: 400
2025-11-30 17:09:13 -     ❌ Error creando Task TASK-101: Implementar vela doctor: 400
2025-11-30 17:09:14 -     ❌ Error creando Task TASK-102: Diseñar manifest format (vela.yaml): 400
2025-11-30 17:09:15 -   ✅ Sprint creado: Sprint 37 (ID: 39)
2025-11-30 17:09:16 -     ❌ Error creando Task TASK-103: Implementar vela install: 400
2025-11-30 17:09:17 -     ❌ Error creando Task TASK-104: Implementar dependency resolution: 400
2025-11-30 17:09:18 -   ✅ Sprint creado: Sprint 38 (ID: 40)
2025-11-30 17:09:19 -     ❌ Error creando Task TASK-105: Implementar vela publish: 400
2025-11-30 17:09:19 -     ❌ Error creando Task TASK-106: Tests de package manager: 400
2025-11-30 17:09:20 -     ❌ Error creando Task TASK-107: Implementar LSP server base: 400
2025-11-30 17:09:22 -   ✅ Sprint creado: Sprint 39 (ID: 41)
2025-11-30 17:09:22 -     ❌ Error creando Task TASK-108: Implementar textDocument/completion: 400
2025-11-30 17:09:23 -     ❌ Error creando Task TASK-109: Implementar textDocument/hover: 400
2025-11-30 17:09:24 -     ❌ Error creando Task TASK-110: Implementar textDocument/definition: 400
2025-11-30 17:09:25 -   ✅ Sprint creado: Sprint 40 (ID: 42)
2025-11-30 17:09:26 -     ❌ Error creando Task TASK-111: Implementar textDocument/publishDiagnostics: 400
2025-11-30 17:09:27 -     ❌ Error creando Task TASK-112: Implementar textDocument/rename: 400
2025-11-30 17:09:28 -     ❌ Error creando Task TASK-113: Tests de LSP: 400
2025-11-30 17:09:28 -     ❌ Error creando Task TASK-113A: Diseñar arquitectura del Event Bus: 400
2025-11-30 17:09:29 -     ❌ Error creando Task TASK-113B: Implementar EventBus<T> core: 400
2025-11-30 17:09:30 -     ❌ Error creando Task TASK-113C: Implementar EventEmitter interface: 400
2025-11-30 17:09:31 -     ❌ Error creando Task TASK-113D: Implementar Subscription type: 400
2025-11-30 17:09:32 -     ❌ Error creando Task TASK-113E: Tests de Event System: 400
2025-11-30 17:09:33 -     ❌ Error creando Task TASK-113F: Diseñar arquitectura de validación: 400
2025-11-30 17:09:34 -     ❌ Error creando Task TASK-113G: Implementar decoradores de validación: 400
2025-11-30 17:09:35 -     ❌ Error creando Task TASK-113H: Implementar Schema builder API: 400
2025-11-30 17:09:36 -     ❌ Error creando Task TASK-113I: Implementar ValidationErrors type: 400
2025-11-30 17:09:37 -     ❌ Error creando Task TASK-113J: Integrar validación con DTOs y formularios: 400
2025-11-30 17:09:38 -     ❌ Error creando Task TASK-113K: Tests de validación: 400
2025-11-30 17:09:38 -     ❌ Error creando Task TASK-113L: Diseñar arquitectura de logging: 400
2025-11-30 17:09:39 -     ❌ Error creando Task TASK-113M: Implementar Logger class: 400
2025-11-30 17:09:40 -     ❌ Error creando Task TASK-113N: Implementar structured logging (JSON): 400
2025-11-30 17:09:41 -     ❌ Error creando Task TASK-113O: Implementar log transports: 400
2025-11-30 17:09:42 -     ❌ Error creando Task TASK-113P: Implementar log filtering y sampling: 400
2025-11-30 17:09:43 -     ❌ Error creando Task TASK-113Q: Tests de logging system: 400
2025-11-30 17:09:44 -     ❌ Error creando Task TASK-113R: Diseñar arquitectura de i18n: 400
2025-11-30 17:09:45 -     ❌ Error creando Task TASK-113S: Implementar translation loader: 400
2025-11-30 17:09:46 -     ❌ Error creando Task TASK-113T: Implementar string interpolation en traducciones: 400
2025-11-30 17:09:47 -     ❌ Error creando Task TASK-113U: Implementar date/number formatting por locale: 400
2025-11-30 17:09:48 -     ❌ Error creando Task TASK-113V: Implementar @i18n decorator y hot reload: 400
2025-11-30 17:09:49 -     ❌ Error creando Task TASK-113W: Tests de i18n system: 400
2025-11-30 17:09:50 -     ❌ Error creando Task TASK-113X: Diseñar arquitectura de service registry: 400
2025-11-30 17:09:50 -     ❌ Error creando Task TASK-113Y: Implementar ServiceRegistry interface: 400
2025-11-30 17:09:51 -     ❌ Error creando Task TASK-113Z: Implementar Consul integration: 400
2025-11-30 17:09:52 -     ❌ Error creando Task TASK-113AA: Implementar service discovery client: 400
2025-11-30 17:09:53 -     ❌ Error creando Task TASK-113AB: Implementar health check endpoints: 400
2025-11-30 17:09:54 -     ❌ Error creando Task TASK-113AC: Tests de service discovery: 400
2025-11-30 17:09:55 -     ❌ Error creando Task TASK-113AD: Diseñar arquitectura de message brokers: 400
2025-11-30 17:09:56 -     ❌ Error creando Task TASK-113AE: Implementar MessageBroker interface: 400
2025-11-30 17:09:57 -     ❌ Error creando Task TASK-113AF: Implementar RabbitMQ integration: 400
2025-11-30 17:09:58 -     ❌ Error creando Task TASK-113AG: Implementar decoradores @consumer y @subscribe: 400
2025-11-30 17:09:59 -     ❌ Error creando Task TASK-113AH: Implementar retry y dead letter queues: 400
2025-11-30 17:10:00 -     ❌ Error creando Task TASK-113AI: Tests de message brokers: 400
2025-11-30 17:10:01 -     ❌ Error creando Task TASK-113AJ: Diseñar resilience patterns: 400
2025-11-30 17:10:02 -     ❌ Error creando Task TASK-113AK: Implementar @circuitBreaker decorator: 400
2025-11-30 17:10:03 -     ❌ Error creando Task TASK-113AL: Implementar @retry decorator: 400
2025-11-30 17:10:04 -     ❌ Error creando Task TASK-113AM: Implementar @timeout decorator: 400
2025-11-30 17:10:06 -     ❌ Error creando Task TASK-113AN: Implementar @bulkhead decorator: 400
2025-11-30 17:10:06 -     ❌ Error creando Task TASK-113AO: Implementar @fallback decorator: 400
2025-11-30 17:10:07 -     ❌ Error creando Task TASK-113AP: Tests de resilience patterns: 400
2025-11-30 17:10:09 -     ❌ Error creando Task TASK-113AQ: Diseñar arquitectura de observability: 400
2025-11-30 17:10:10 -     ❌ Error creando Task TASK-113AR: Implementar OpenTelemetry integration: 400
2025-11-30 17:10:10 -     ❌ Error creando Task TASK-113AS: Implementar Prometheus metrics: 400
2025-11-30 17:10:12 -     ❌ Error creando Task TASK-113AT: Implementar @traced decorator: 400
2025-11-30 17:10:13 -     ❌ Error creando Task TASK-113AU: Implementar metrics exporters: 400
2025-11-30 17:10:16 -     ❌ Error creando Task TASK-113AV: Tests de observability: 400
2025-11-30 17:10:17 -     ❌ Error creando Task TASK-113AW: Diseñar arquitectura de ORM: 400
2025-11-30 17:10:19 -     ❌ Error creando Task TASK-113AX: Implementar decoradores @entity, @id, @column: 400
2025-11-30 17:10:19 -     ❌ Error creando Task TASK-113AY: Implementar query builder type-safe: 400
2025-11-30 17:10:20 -     ❌ Error creando Task TASK-113AZ: Implementar relations (@oneToMany, @manyToOne): 400
2025-11-30 17:10:21 -     ❌ Error creando Task TASK-113BA: Implementar migrations system: 400
2025-11-30 17:10:22 -     ❌ Error creando Task TASK-113BB: Implementar connection pooling: 400
2025-11-30 17:10:23 -     ❌ Error creando Task TASK-113BC: Tests de ORM: 400
2025-11-30 17:10:24 -     ❌ Error creando Task TASK-113BD: Diseñar Crypto API: 400
2025-11-30 17:10:25 -     ❌ Error creando Task TASK-113BE: Implementar hashing (SHA256, bcrypt, argon2): 400
2025-11-30 17:10:26 -     ❌ Error creando Task TASK-113BF: Implementar encryption (AES-256-GCM): 400
2025-11-30 17:10:27 -     ❌ Error creando Task TASK-113BG: Implementar JWT support: 400
2025-11-30 17:10:27 -     ❌ Error creando Task TASK-113BH: Implementar digital signatures (RSA, ECDSA): 400
2025-11-30 17:10:28 -     ❌ Error creando Task TASK-113BI: Tests de cryptography: 400
2025-11-30 17:10:29 -     ❌ Error creando Task TASK-113BJ: Diseñar sistema de serialización: 400
2025-11-30 17:10:30 -     ❌ Error creando Task TASK-113BK: Implementar @serializable decorator: 400
2025-11-30 17:10:31 -     ❌ Error creando Task TASK-113BL: Implementar field mapping (@serialize name): 400
2025-11-30 17:10:32 -     ❌ Error creando Task TASK-113BM: Implementar custom serializers: 400
2025-11-30 17:10:33 -     ❌ Error creando Task TASK-113BN: Implementar @ignore decorator: 400
2025-11-30 17:10:34 -     ❌ Error creando Task TASK-113BO: Tests de serialization: 400
2025-11-30 17:10:35 -     ❌ Error creando Task TASK-113BP: Diseñar arquitectura de config: 400
2025-11-30 17:10:36 -     ❌ Error creando Task TASK-113BQ: Implementar config loader: 400
2025-11-30 17:10:37 -     ❌ Error creando Task TASK-113BR: Implementar @config decorator: 400
2025-11-30 17:10:38 -     ❌ Error creando Task TASK-113BS: Implementar hot reload de config: 400
2025-11-30 17:10:39 -     ❌ Error creando Task TASK-113BT: Tests de config management: 400
2025-11-30 17:10:40 -     ❌ Error creando Task TASK-113BU: Diseñar arquitectura de API Gateway: 400
2025-11-30 17:10:41 -     ❌ Error creando Task TASK-113BV: Implementar @gateway decorator: 400
2025-11-30 17:10:42 -     ❌ Error creando Task TASK-113BW: Implementar routing dinámico: 400
2025-11-30 17:10:43 -     ❌ Error creando Task TASK-113BX: Implementar load balancing strategies: 400
2025-11-30 17:10:44 -     ❌ Error creando Task TASK-113BY: Implementar rate limiting: 400
2025-11-30 17:10:44 -     ❌ Error creando Task TASK-113BZ: Tests de API Gateway: 400
2025-11-30 17:10:45 -     ❌ Error creando Task TASK-113CA: Diseñar gRPC integration: 400
2025-11-30 17:10:46 -     ❌ Error creando Task TASK-113CB: Implementar @grpc.service decorator: 400
2025-11-30 17:10:47 -     ❌ Error creando Task TASK-113CC: Implementar @grpc.method decorator: 400
2025-11-30 17:10:48 -     ❌ Error creando Task TASK-113CD: Implementar server y client streaming: 400
2025-11-30 17:10:49 -     ❌ Error creando Task TASK-113CE: Implementar code generation desde .proto: 400
2025-11-30 17:10:50 -     ❌ Error creando Task TASK-113CF: Tests de gRPC: 400
2025-11-30 17:10:51 -     ❌ Error creando Task TASK-113CG: Implementar widget testing: 400
2025-11-30 17:10:52 -     ❌ Error creando Task TASK-113CH: Implementar snapshot testing: 400
2025-11-30 17:10:53 -     ❌ Error creando Task TASK-113CI: Implementar mocking framework: 400
2025-11-30 17:10:54 -     ❌ Error creando Task TASK-113CJ: Implementar property-based testing: 400
2025-11-30 17:10:55 -     ❌ Error creando Task TASK-113CK: Implementar integration testing helpers: 400
2025-11-30 17:10:56 -     ❌ Error creando Task TASK-113CL: Tests del testing framework avanzado: 400
2025-11-30 17:10:57 -   ✅ Sprint creado: Sprint 41 (ID: 43)
2025-11-30 17:10:58 -     ❌ Error creando Task TASK-114: Implementar JS code generator: 400
2025-11-30 17:10:59 -     ❌ Error creando Task TASK-115: Implementar signals runtime en JS: 400
2025-11-30 17:11:00 -   ✅ Sprint creado: Sprint 42 (ID: 44)
2025-11-30 17:11:01 -     ❌ Error creando Task TASK-116: Implementar UI renderer para DOM: 400
2025-11-30 17:11:02 -     ❌ Error creando Task TASK-117: Tests de backend JS: 400
2025-11-30 17:11:03 -     ❌ Error creando Task TASK-117A: Implementar destructuring avanzado: 400
2025-11-30 17:11:04 -     ❌ Error creando Task TASK-117B: Implementar guards complejos: 400
2025-11-30 17:11:05 -   ✅ Sprint creado: Sprint 43 (ID: 45)
2025-11-30 17:11:06 -     ❌ Error creando Task TASK-117C: Implementar or patterns: 400
2025-11-30 17:11:06 -     ❌ Error creando Task TASK-117D: Implementar range patterns: 400
2025-11-30 17:11:07 -     ❌ Error creando Task TASK-117E: Implementar pattern en lambdas: 400
2025-11-30 17:11:08 -     ❌ Error creando Task TASK-117F: Tests de pattern matching avanzado: 400
2025-11-30 17:11:10 -   ✅ Sprint creado: Sprint 44 (ID: 46)
2025-11-30 17:11:10 -     ❌ Error creando Task TASK-117G: Diseñar arquitectura de async iterators: 400
2025-11-30 17:11:11 -     ❌ Error creando Task TASK-117H: Implementar async function* syntax: 400
2025-11-30 17:11:12 -     ❌ Error creando Task TASK-117I: Implementar AsyncIterator<T> type: 400
2025-11-30 17:11:13 -     ❌ Error creando Task TASK-117J: Implementar Stream API: 400
2025-11-30 17:11:14 -   ✅ Sprint creado: Sprint 45 (ID: 47)
2025-11-30 17:11:15 -     ❌ Error creando Task TASK-117K: Implementar backpressure: 400
2025-11-30 17:11:16 -     ❌ Error creando Task TASK-117L: Tests de async iterators: 400
2025-11-30 17:11:17 -     ❌ Error creando Task TASK-117M: Diseñar arquitectura de worker pools: 400
2025-11-30 17:11:18 -     ❌ Error creando Task TASK-117N: Implementar WorkerPool class: 400
2025-11-30 17:11:19 -   ✅ Sprint creado: Sprint 46 (ID: 48)
2025-11-30 17:11:19 -     ❌ Error creando Task TASK-117O: Implementar parallel map/reduce: 400
2025-11-30 17:11:20 -     ❌ Error creando Task TASK-117P: Implementar task scheduling: 400
2025-11-30 17:11:21 -     ❌ Error creando Task TASK-117Q: Tests de worker pools: 400
2025-11-30 17:11:22 -     ❌ Error creando Task TASK-118: Implementar WASM code generator: 400
2025-11-30 17:11:23 -     ❌ Error creando Task TASK-119: Implementar JS-WASM glue code: 400
2025-11-30 17:11:24 -     ❌ Error creando Task TASK-120: Tests de backend WASM: 400
2025-11-30 17:11:25 -     ❌ Error creando Task TASK-121: Integrar LLVM como dependencia: 400
2025-11-30 17:11:26 -     ❌ Error creando Task TASK-122: Implementar LLVM IR generator: 400
2025-11-30 17:11:27 -     ❌ Error creando Task TASK-123: Implementar runtime library en C: 400
2025-11-30 17:11:27 -     ❌ Error creando Task TASK-124: Implementar linking pipeline: 400
2025-11-30 17:11:28 -     ❌ Error creando Task TASK-125: Implementar optimizaciones LLVM: 400
2025-11-30 17:11:29 -     ❌ Error creando Task TASK-126: Tests de backend nativo: 400
2025-11-30 17:11:31 -   ✅ Sprint creado: Sprint 47 (ID: 49)
2025-11-30 17:11:31 -     ❌ Error creando Task TASK-127: Implementar test API (describe, it, expect): 400
2025-11-30 17:11:32 -     ❌ Error creando Task TASK-128: Implementar test runner: 400
2025-11-30 17:11:33 -     ❌ Error creando Task TASK-129: Implementar assertions library: 400
2025-11-30 17:11:35 -   ✅ Sprint creado: Sprint 48 (ID: 50)
2025-11-30 17:11:35 -     ❌ Error creando Task TASK-130: Implementar code coverage: 400
2025-11-30 17:11:36 -     ❌ Error creando Task TASK-131: Tests del testing framework: 400
2025-11-30 17:11:37 -     ❌ Error creando Task TASK-132: Escribir Language Specification completa: 400
2025-11-30 17:11:38 -   ✅ Sprint creado: Sprint 49 (ID: 51)
2025-11-30 17:11:39 -     ❌ Error creando Task TASK-133: Escribir Getting Started Guide: 400
2025-11-30 17:11:40 -     ❌ Error creando Task TASK-134: Escribir API Reference completa: 400
2025-11-30 17:11:41 -   ✅ Sprint creado: Sprint 50 (ID: 52)
2025-11-30 17:11:42 -     ❌ Error creando Task TASK-135: Escribir guías de conceptos (signals, actors, UI): 400
2025-11-30 17:11:43 -     ❌ Error creando Task TASK-136: Crear tutoriales completos (Todo App, Chat App): 400
2025-11-30 17:11:44 -   ✅ Sprint creado: Sprint 51 (ID: 53)
2025-11-30 17:11:44 -     ❌ Error creando Task TASK-137: Setup documentation website: 400
2025-11-30 17:11:45 -     ❌ Error creando Task TASK-138: Implementar debug info generation: 400
2025-11-30 17:11:46 -     ❌ Error creando Task TASK-139: Implementar breakpoint support en VelaVM: 400
2025-11-30 17:11:47 -   ✅ Sprint creado: Sprint 52 (ID: 54)
2025-11-30 17:11:48 -     ❌ Error creando Task TASK-140: Implementar DAP (Debug Adapter Protocol): 400
2025-11-30 17:11:49 -     ❌ Error creando Task TASK-141: Implementar signal inspector: 400
2025-11-30 17:11:50 -     ❌ Error creando Task TASK-142: Tests de debugging tools: 400
2025-11-30 17:11:51 -   ✅ Sprint creado: Sprint 53 (ID: 55)
2025-11-30 17:11:52 -     ❌ Error creando Task TASK-143: Implementar Animated widget: 400
2025-11-30 17:11:53 -     ❌ Error creando Task TASK-144: Implementar AnimationController: 400
2025-11-30 17:11:53 -     ❌ Error creando Task TASK-145: Implementar curves y easing: 400
2025-11-30 17:11:55 -   ✅ Sprint creado: Sprint 54 (ID: 56)
2025-11-30 17:11:55 -     ❌ Error creando Task TASK-146: Tests de animaciones: 400
2025-11-30 17:11:56 -     ❌ Error creando Task TASK-147: Implementar GestureDetector completo: 400
2025-11-30 17:11:57 -     ❌ Error creando Task TASK-148: Tests de gestures: 400
2025-11-30 17:11:58 -   ✅ Sprint creado: Sprint 55 (ID: 57)
2025-11-30 17:11:59 -     ❌ Error creando Task TASK-149: Implementar ListView virtualizado: 400
2025-11-30 17:12:00 -     ❌ Error creando Task TASK-150: Implementar GridView virtualizado: 400
2025-11-30 17:12:01 -     ❌ Error creando Task TASK-151: Tests de virtualización: 400
2025-11-30 17:12:02 -   ✅ Sprint creado: Sprint 56 (ID: 58)
2025-11-30 17:12:03 -     ❌ Error creando Task TASK-152: Diseñar iOS render engine: 400
2025-11-30 17:12:03 -     ❌ Error creando Task TASK-153: Implementar bridging Swift/Vela: 400
2025-11-30 17:12:05 -   ✅ Sprint creado: Sprint 57 (ID: 59)
2025-11-30 17:12:05 -     ❌ Error creando Task TASK-154: Implementar iOS renderer: 400
2025-11-30 17:12:07 -   ✅ Sprint creado: Sprint 58 (ID: 60)
2025-11-30 17:12:07 -     ❌ Error creando Task TASK-155: Implementar vela build --target=ios: 400
2025-11-30 17:12:08 -     ❌ Error creando Task TASK-156: Tests en iOS: 400
2025-11-30 17:12:09 -     ❌ Error creando Task TASK-157: Diseñar Android render engine: 400
2025-11-30 17:12:10 -   ✅ Sprint creado: Sprint 59 (ID: 61)
2025-11-30 17:12:11 -     ❌ Error creando Task TASK-158: Implementar bridging Java/Kotlin/Vela: 400
2025-11-30 17:12:12 -     ❌ Error creando Task TASK-159: Implementar Android renderer: 400
2025-11-30 17:12:13 -   ✅ Sprint creado: Sprint 60 (ID: 62)
2025-11-30 17:12:14 -     ❌ Error creando Task TASK-160: Implementar vela build --target=android: 400
2025-11-30 17:12:15 -     ❌ Error creando Task TASK-161: Tests en Android: 400
2025-11-30 17:12:15 -     ❌ Error creando Task TASK-162: Diseñar desktop runtime (C++): 400
2025-11-30 17:12:17 -   ✅ Sprint creado: Sprint 61 (ID: 63)
2025-11-30 17:12:17 -     ❌ Error creando Task TASK-163: Implementar desktop renderer (Skia): 400
2025-11-30 17:12:19 -   ✅ Sprint creado: Sprint 62 (ID: 64)
2025-11-30 17:12:19 -     ❌ Error creando Task TASK-164: Implementar system APIs (file, process, etc.): 400
2025-11-30 17:12:20 -     ❌ Error creando Task TASK-165: Implementar vela build --target=desktop: 400
2025-11-30 17:12:21 -   ✅ Sprint creado: Sprint 63 (ID: 65)
2025-11-30 17:12:22 -     ❌ Error creando Task TASK-166: Tests en desktop: 400
2025-11-30 17:12:23 -     ❌ Error creando Task TASK-167: Diseñar FFI system: 400
2025-11-30 17:12:24 -     ❌ Error creando Task TASK-168: Implementar extern declarations: 400
2025-11-30 17:12:25 -   ✅ Sprint creado: Sprint 64 (ID: 66)
2025-11-30 17:12:26 -     ❌ Error creando Task TASK-169: Implementar C FFI bridge: 400
2025-11-30 17:12:27 -     ❌ Error creando Task TASK-170: Tests de FFI: 400
2025-11-30 17:12:28 -     ❌ Error creando Task TASK-171: Implementar constant folding: 400
2025-11-30 17:12:29 -   ✅ Sprint creado: Sprint 65 (ID: 67)
2025-11-30 17:12:29 -     ❌ Error creando Task TASK-172: Implementar dead code elimination: 400
2025-11-30 17:12:30 -     ❌ Error creando Task TASK-173: Implementar function inlining: 400
2025-11-30 17:12:31 -     ❌ Error creando Task TASK-174: Implementar signal graph optimization: 400
2025-11-30 17:12:33 -   ✅ Sprint creado: Sprint 66 (ID: 68)
2025-11-30 17:12:33 -     ❌ Error creando Task TASK-175: Implementar JIT compilation (experimental): 400
2025-11-30 17:12:34 -     ❌ Error creando Task TASK-176: Implementar vela deploy: 400
2025-11-30 17:12:36 -   ✅ Sprint creado: Sprint 67 (ID: 69)
2025-11-30 17:12:36 -     ❌ Error creando Task TASK-177: Integración con AWS Lambda: 400
2025-11-30 17:12:37 -     ❌ Error creando Task TASK-178: Integración con Vercel/Netlify: 400
2025-11-30 17:12:38 -     ❌ Error creando Task TASK-179: Tests de deployment: 400
2025-11-30 17:12:38 - 
🔗 FASE 4: Creando Dependencies...
2025-11-30 17:12:38 - 
======================================================================
2025-11-30 17:12:38 - ✅ IMPORTACIÓN COMPLETADA
2025-11-30 17:12:38 - ======================================================================
2025-11-30 17:12:38 - 
📊 Resumen:
2025-11-30 17:12:38 -    - Epics existentes: 47
2025-11-30 17:12:38 -    - Stories creados: 68
2025-11-30 17:12:38 -    - Tasks creados: 0
2025-11-30 17:12:38 -    - Sprints creados: 68
2025-11-30 17:12:38 -    - Links creados: 0
2025-11-30 17:12:38 -    - Errores: 354
2025-11-30 17:12:38 - 
⚠️ Se encontraron 354 errores:
2025-11-30 17:12:38 -    - Error creando Task TASK-000A: Decidir lenguaje de implementación: 400
2025-11-30 17:12:38 -    - Error creando Task TASK-000B: Definir arquitectura del build system: 400
2025-11-30 17:12:38 -    - Error creando Task TASK-000C: Elegir licencia open source: 400
2025-11-30 17:12:38 -    - Error creando Task TASK-000D: Seleccionar plataforma CI/CD: 400
2025-11-30 17:12:38 -    - Error creando Task TASK-000E: Elegir plataforma de documentación: 400
2025-11-30 17:12:38 -    - Error creando Task TASK-000F: Escribir especificación formal del lenguaje: 400
2025-11-30 17:12:38 -    - Error creando Task TASK-000G: Especificar modelo de memoria formal: 400
2025-11-30 17:12:38 -    - Error creando Task TASK-000H: Especificar modelo de concurrencia formal: 400
2025-11-30 17:12:38 -    - Error creando Task TASK-000I: Escribir contratos formales de stdlib: 400
2025-11-30 17:12:38 -    - Error creando Task TASK-000J: Diseñar arquitectura del Vela CLI: 400
2025-11-30 17:12:38 - 
 Tu backlog está listo en: https://velalang.atlassian.net/projects/VELA
2025-11-30 17:12:38 - 
 Log completo guardado en: import_log_20251130_170242.txt
